B1: Ratio H-alpha:H-beta | C1: Ratio OIIIa:OIIIb | D1: Ratio H-alpha:OIIIa | E1: Ratio H-alpha:HeII | F1: Ratio H-alpha:SII | G1: Ratio H-alpha:NaI
A2: Inner | B2: 5.6338028169014089 | C2: 6.1324041811846683 | D2: 0.68181818181818188 | E2: 14.981273408239701 | F2: 27.522935779816514 | G2: 1.242165242165242
A3: Outer | B3: 5.5992141453831046 | C3: 6.1775700934579438 | D3: 0.43116490166414523 | E3: 11.92468619246862 | F3: 19.127516778523493 | G3: 15.921787709497208
A4: RO/RI | B4: =B3/B2 -> 0.99386051080550097 | C4: =C3/C2 -> 1.0073651231945626 | D4: =D3/D2 -> 0.63237518910741297 | E4: =E3/E2 -> 0.79597280334728038 | F4: =F3/F2 -> 0.69496644295302024 | G4: =G3/G2 -> 12.817769463379634
B5: Inverse | C5: Inverse | D5: Inverse | E5: Inverse | F5: Inverse | G5: Inverse
A6: Inner | B6: =1/B2 -> 0.17749999999999999 | C6: =1/C2 -> 0.16306818181818183 | D6: =1/D2 -> 1.4666666666666666 | E6: =1/E2 -> 6.674999999999999E-2 | F6: =1/F2 -> 3.6333333333333336E-2 | G6: =1/G2 -> 0.80504587155963314
A7: Outer | B7: =1/B3 -> 0.17859649122807017 | C7: =1/C3 -> 0.16187594553706505 | D7: =1/D3 -> 2.3192982456140352 | E7: =1/E3 -> 8.3859649122807009E-2 | F7: =1/F3 -> 5.2280701754385955E-2 | G7: =1/G3 -> 6.2807017543859645E-2

A1: Line | B1: Actual Wavelength | C1: Measured Wavelength
A2: H-alpha | B2: 6563 | C2: 6569.78
A3: H-beta | B3: 4861 | C3: 4863.3649999999998
A4: HI/OIII Blend | B4: 4340 and 4363 | C4: 4354.8649999999998
A5: OIII | B5: 4959 | C5: 4955.16
A6: OIII | B6: 5007 | C6: 5007.86
A7: SII | B7: 6717 and 6731 | C7: 6733.6350000000002
A8: NaI | B8: 5890 and 5895 | C8: 5886.18
A9: HeII | B9: 4686 | C9: 4683.6750000000002